{
  "payload_schema_version": "0",
  "schema_version": "2",
  "projection_algo_version": "spec-engine-projection:v5",
  "canon_version": "v2",
  "idmodel_version": "v1",
  "kind_alignment_version": "1",
  "permitted_freedom_vocab_version": "1",
  "certificate_digest": "b1f1e140fa28457a372e451c4d72b96614a99c3f9bbcdebef14125d97a549f93",
  "ec_revision_id": "ec-rev-pf",
  "spec_revision_digest": "affd015069e9a420f3ff3b2e31631c410954fed10c3a534b50b8ef5ec73e4359",
  "desired_graph_digest": "b283d27e873f30c1d98053b8ef5f6ac7c785e3225c05e4d63501f6abead30a56",
  "ec_digest": "5ee7532ba449deee08f285692887de2e190170625d981f4c51100057b74c64fa",
  "ec_reproducible": false,
  "advisory": true,
  "spec_authority": "grounded",
  "code_head_sha": "0000000000000000000000000000000000000002",
  "overall_result_state": "pass",
  "badge": "green",
  "dimension_results": [
    {
      "dimension": "completeness",
      "result_state": "pass",
      "checks_evaluated": 2
    },
    {
      "dimension": "soundness",
      "result_state": "pass",
      "checks_evaluated": 2
    },
    {
      "dimension": "closure",
      "result_state": "pass",
      "checks_evaluated": 2
    },
    {
      "dimension": "prohibition",
      "result_state": "not_applicable",
      "checks_evaluated": 0
    },
    {
      "dimension": "revision_alignment",
      "result_state": "not_applicable",
      "checks_evaluated": 0
    },
    {
      "dimension": "acceptance",
      "result_state": "not_applicable",
      "checks_evaluated": 0,
      "acceptance_results": []
    }
  ],
  "finding_summaries": [
    {
      "finding_id": "a106507bfad328783fa0e3d3bc9a2fc913753a8c1c7a40c434052786edbbf08c",
      "dimension": "soundness",
      "result_state": "fail",
      "code": "prohibition_violated",
      "title": "Prohibition violated",
      "location": {
        "desired_logical_id": "f19715d315eeda770a839cfbedbd8655f8e30ab52f2d59c04d94cbaac6047086",
        "realized_occurrence_id": "75ddf9f3fdefc03aa3bbde9be81a988f2fdc08d788ad0747d02164d6633c7958",
        "desired_kind": "interface",
        "realized_kind": "interface"
      }
    }
  ],
  "findings_ref": "933662f6df6d3bb6bc581b6c88e5897f2f6b6d5514bf56c9263cfc5bc5c5ccf0",
  "digest": "82f8b7e1bc44d856d9183054e94b179d921beda2cd37c850a38b1461b2a2d167"
}
